{
  "bundle_version": "1.0",
  "bundle_id": "example-update-001",
  "generated_at": "2026-08-13T17:00:00Z",
  "research_scope": {
    "type": "opportunity_update",
    "as_of_date": "2026-08-13",
    "requested_vocation_ids": [
      "voc-opp-001"
    ],
    "requested_fields": [
      "availability",
      "work_model"
    ]
  },
  "sources": [
    {
      "id": "src-company",
      "name": "Example Careers",
      "type": "company_careers",
      "base_url": "https://example.com/careers"
    }
  ],
  "companies": [
    {
      "id": "cmp-example",
      "canonical_name": "Example GmbH",
      "vocation_company_id": "voc-company-001"
    }
  ],
  "opportunities": [
    {
      "id": "opp-example",
      "company_id": "cmp-example",
      "canonical_title": "Junior Softwareentwickler",
      "vocation_opportunity_id": "voc-opp-001"
    }
  ],
  "postings": [
    {
      "id": "post-example",
      "source_id": "src-company",
      "opportunity_id": "opp-example",
      "title": "Junior Softwareentwickler",
      "url": "https://example.com/careers/junior-dev",
      "observed_at": "2026-08-13T16:00:00Z",
      "availability": "explicitly_available"
    }
  ],
  "observations": [
    {
      "id": "obs-work-model",
      "subject_type": "posting",
      "subject_id": "post-example",
      "type": "work_model",
      "value": "hybrid",
      "observed_at": "2026-08-13T16:00:00Z",
      "source_id": "src-company",
      "confidence": 0.95,
      "evidence_summary": "Posting states hybrid work"
    }
  ],
  "assessments": [],
  "warnings": []
}
